,title,views,description,likes,date
0,NEWSERS (69),734.0,"NEWSERS est une application qui offre de l’information à travers trois interfaces (articles, SWIPE, et communautaire). Newsers est donc une solution de débat...",94.0,03-25
1,B.Y.O DESIGNER (94),247.0,"La raison d'être de B.Y.O. Designer est de permettre à tout un chacun d'être le créateur, le styliste de ce qu'il porte.- Projet porté par Mariam TambouraPou...",37.0,03-25
2,EDUCATION DU CHEVAL (83),805.0,La mission d'EDUCATION DU CHEVAL est de faire évoluer l'équitation vers des pratiques plus justes et éthiques pour l'animal afin de diminuer le nombre d'acci...,180.0,03-25
3,CENTRAL EVENTS (90),78.0,"CENTRAL EVENTS souhaite créer et développer une plateforme de mise en relation entre les prestataires liés à l'événementiel et leurs clients, afin de simplif...",1.0,03-25
4,LOOSE SOULS (31),81.0,La raison d'être de LOOSE SOULS c'est représenter les artistes féminines et non binaires sur la scène musicale. Ils proposent de présenter ces artistes par l...,1.0,03-25
5,L'IDÉE D'UNE BOITE (95),387.0,L'IDÉE D'UNE BOITE souhaite développer des boîtes mystères thématiques interactives qui permettent de vivre une expérience lors de l’ouverture séquencée et p...,61.0,03-25
6,SKANERS (92),101.0,"SKANERS est une application qui permet d’identifier et acheter les paires de sneakers qui vous entourent avec une photo ! Autrement dit, c'est le ""Shazam"" de...",2.0,03-25
7,ALGUP (06),272.0,AlgUp développe un bioréacteur qui permet de produire de la spiruline fraîche chez soi et sans entretien. Conçu pour être à la fois esthétique et facile d’ut...,29.0,03-25
8,KOOKABURRA KOMBUCHA (59) Kookaburra Kombucha,79.0,"KOOKABURRA KOMBUCHA propose la vente de Kombucha, une boisson asiatique.- Projet porté par Elise GensPour suivre le Moovjee : Site : https://www.moovjee.frFa...",1.0,03-25
9,RENTY (75),189.0,"RENTY est une plateforme en ligne pour la location d'équipements sportifs entre particuliers, et une assurance facultative pour les locataires pour couvrir l...",11.0,03-25
10,RACE&LOCK (92),489.0,"RACE&LOCK propose un cadenas de vélo à triple usage, offrant aux vélos urbains ou électriques un porte-bagages et aux vélos sportifs une position de course a...",149.0,03-25
11,24-7 (67),707.0,"24-7 souhaite fournir des aliments durables et nutritifs, sans compromis sur le goût, la qualité et le prix afin de créer un avenir meilleur et plus sain pou...",87.0,03-25
12,BECOME (67),73.0,"BECOME souhaite faciliter la prise de décisions complexe par la réécriture rapide et neutre de votre démarche et situations.Adopter des comportements, compét...",0.0,03-25
13,TALEOS (77),37.0,TALEOS est une application de réveil personnalisée selon son chronotype qui améliore son sommeil et ses performances cognitives pour optimiser son temps chaq...,0.0,03-25
14,NYMPHEIASHOP (35),69.0,NYMPHEIASHOP crée des oeuvres au format numérique mais également des illustrations sous forme de produits physiques tels que des cartes postales et des badge...,12.0,03-25
15,STUDPRO (75),59.0,STUDPRO est une application web et mobile pensée pour révolutionner le quotidien des étudiants. Elle permettra aux étudiants de trouver leur entreprise d’acc...,2.0,03-25
16,ARTY SQUAD (75),116.0,ART-SQUAD accompagne les entreprises soucieuses d'améliorer leur expérience collaborateur et l'engagement de leur équipe grâce à l'art et à la culture afin d...,14.0,03-25
17,THE OFFSZN (69),264.0,La raison d'être d'OFFSZN est de créer un mouvement social et inclusif autour de la pratique du basket en France en créant des opportunités sociales et sport...,54.0,03-25
18,HOLMI (94),208.0,HOLMI propose des vêtements éthiques et éco-responsables. Ils prenent temps pour développer chaque pièce pour qu'elles conviennent à un maximum de morphologi...,54.0,03-25
19,POGUISURF (59),156.0,"POGUISURF propose une location longue durée d'une planche de surf éco-responsable qui est produite localement, réparable et avec une durée de vie 5 fois supé...",23.0,03-25
20,BE BUDDY (69),51.0,La mission de BE BUDDY est d'offrir une nouvelle façon de voyager au plus proche de la culture locale grâce à un guide digital personnalisé. Ils ont à coeur ...,3.0,03-25
21,TOGÆTHER (34),468.0,"TOGÆTHER est une application directement sur le mobile des spectateurs ainsi qu'un appareil de géolocalisation positionné sur les sportifs. Les deux liés, on...",62.0,03-25
22,DOUCEUR DANS L'HAIR (22),92.0,DOUCEUR DANS L'HAIR a pour projet de développer des gammes de produits capillaires pour cheveux texturés à base de beurres et d'huiles végétales afro-caraibé...,31.0,03-25
23,NEATY (83),23.0,"NEATY a pour objectif de développer une marque de produits de première nécessité écoresponsable (rechargeables), avec une composition saine mais également in...",0.0,03-25
24,YUKI (13),114.0,YUKI propose des jeux uniques et personnalisés qui rapprochent les gens !- Projet porté par Benoit CatanesePour suivre le Moovjee : Site : https://www.moovje...,11.0,03-25
25,RECIT (94),23.0,"Avec RECIT, concevez le livre des moments les plus importants de votre vie à transmettre à vos proches. Enregistrez les histoires de vos proches. Ces dernièr...",3.0,03-25
26,KASSY (75),33.0,KASSY est une société commerciale qui a pour objectif de faire découvrir aux consommateurs des produits artisanaux provenant de différentes régions du monde....,4.0,03-25
27,OVA DETECH (17),609.0,OVA DETECH accompagne toutes les femmes du début de leur vie sexuelle jusqu’à la ménopause en leur permettant de mieux connaitre leur cycle et donc d’adapter...,98.0,03-25
28,MELOTICK (92),28.0,"MELOTICK est une plateforme culturelle regroupant un agenda culturel pour trouver des événements culturels en France, une bourse aux billets pour acheter ou ...",1.0,03-25
29,V.UBIK (57),71.0,V.UBIK veut intégrer le marché de l'esport en diffusant les différentes parties League of Legend à travers un avatar dans une salle afin de pouvoir partager ...,14.0,03-25
30,PERLA MODA (35),40.0,Perla Moda propose à ses clients des accessoires durables en perles faits à la main qui allient créativité et esthétique pour rendre le luxe d’un bijou ou d’...,10.0,03-25
31,HORMONE.IA (75),65.0,HORMONE.IA développe le premier assistant de fertilité pour couple. Ce dispositif médical (DM) permettra d'accompagner hommes et femmes dans leur parcours de...,13.0,03-25
32,AULIA (59),137.0,La mission d'AULIA est de soulager l'aidant familial dans l'organisation de la dépendance d'une personne en perte d’autonomie à domicile.- Projet de Jade Nue...,30.0,03-25
33,DYOQAR (59),28.0,DYOQAR propose du matériel sportif durables et uniques pour les activités de sport & bien-être à domicile fabriqués à partir de matières bioscourcées.- Proje...,1.0,03-25
34,PAVENROD (74),222.0,PAVENROD est né de la volonté de préserver la montagne en développer un vestiaire complet homme / femme de vêtements outdoor performants made in France en ma...,63.0,03-25
35,MINUIT BLONDE (13),233.0,MINUIT BLONDE est une agence artistique qui propose :- La vente en ligne de pièces produites par des créateurs indépendants- L'organisation d'évènements cult...,50.0,03-25
36,OPENDO (57),14.0,"OPENDO est une épicerie nocturne lambda spécialisée dans les produits exotiques et multiculturels, notamment avec un étalage de fruits et légumes tropicaux, ...",1.0,03-25
37,TASH (44),15.0,TASH souhaite devenir la plateforme référente pour la création de marque de mode originale et responsable. TASH permet aux créateurs de contenu de facilement...,1.0,03-25
38,CELESTINE HAIR MAKEUP ARTIS (59),30.0,CELESTINE HAIR MAKEUP ARTIST propose des prestations de maquillage.- Projet porté par Célestine HelynckPour suivre le Moovjee : Site : https://www.moovjee.fr...,2.0,03-25
39,REVOLEAF (31),24.0,"REVOLEAF propose une culture végétale à base de lentille d'eau. Cette culture amène un nouveau produit frais avec qualités nutritionnelles essentielles, une ...",1.0,03-25
40,FREE2BET (57),19.0,Free2bet est une application mobile de paris sportifs gratuits. Ici pas d'argent en jeu mais des crédits virtuels qui peuvent ensuite être échangés contre de...,0.0,03-25
41,SAUVÈ (69),28.0,"SAUVÈ, ce sont des barres nutritionnelles naturellement riches en fer qui permettent d'optimiser et de renforcer les apports en fer au quotidien.- Projet por...",0.0,03-25
42,LES BELLES TRUFFES (92),441.0,Les Belles Truffes ont pour mission de contribuer aux bien-être des chiens en proposant un service premium et ultra-personnalisé de micro-crèche canine . Par...,113.0,03-25
43,HAPPYPRO (17),210.0,"HappyPro met en relation des professionnels et des particuliers pour du service à domicile de courte durée (PetSitting/Ménage/..). Le concept, regrouper les ...",60.0,03-25
44,MADE IN CLÉMENCE (49),20.0,"Via le processus de surcyclage (ou upcycling), Made In Clémence  transforme les déchets textiles en produits responsables proposés aux particuliers et aux pr...",2.0,03-25
45,IKIDAÏ (59),16.0,"IKIDAÏ développe des bornes interactives et créatives pour enfants. Créatrices de lien social entre enfants et avec leurs accompagnateurs, leurs bornes perme...",0.0,03-25
46,HELLO WASTE (22),35.0,Hello Waste a pour objectif de protéger l'humain et l'environnement. Ils imaginent les objets de demain avec les déchets d'aujourd'hui en proposant de la fab...,1.0,03-25
47,COSPLAY SMART (83),250.0,COSPLAY SMART est un projet de boutique en ligne de vente de produit pour la réalisation de costume cosplay et un service de réalisation de costume sur-mesur...,68.0,03-25
48,SAMADHA (69),60.0,SAMADHA est une boutique en ligne dédiée à l’Ayurvéda qui sélectionne les meilleures marques de produits et propose des outils pratiques et inspirants pour v...,21.0,03-25
49,BLOOSENS (75),747.0,La mission de BLOOSENS est d'apporter une solution à toutes les personnes gênées par leurs douleurs menstruelles. Soulager leur quotidien en leur apportant u...,209.0,03-25
50,PHEASE (74),15.0,PHEASE met à disposition des projets à impact grâce à une plateforme qui assure la transparence de leurs fonds et mettre en avant l'impact réalisé. Cette pla...,1.0,03-25
51,LCDG (64),221.0,"LCDG souhaite rendre accessible la communication physique de produits ou de services plus éthiques, tout en apportant un complément de revenu sans effort sup...",60.0,03-25
52,MITUP (95),50.0,MITUP favorise l'insertion des jeunes talents sur le marché de l'emploi et les accompagner dans leur entrée dans la vie active.  Le service proposé est un ab...,16.0,03-25
53,MOKILO PACKAGE (44),34.0,Mokilo Package est une plateforme marketplace de co-bagage qui connecte les voyageurs pour qu'ils partagent les frais de transport de leurs bagages. Un servi...,3.0,03-25
54,GREEZ (28),21.0,"Greez est une plateforme E-commerce spécialisée dans la gestion d’invendus cosmétiques. Les professionnels, distributeurs qui ont des produits invendus les s...",3.0,03-25
55,ASYORA (92),73.0,ASYORA est un outil de collaboration permettant de repenser la notion de réunion en entreprise.- Projet porté par Paul-Emmanuel BrouxPour suivre le Moovjee :...,17.0,03-25
56,KAYLO (91),25.0,"Kaylo est une application mobile qui permet de faire ses courses et de commander son panier en livraison, en click & collect dans le supermarché où son panie...",1.0,03-25
57,SIZZY (75),15.0,"SIZZY ce sont chaussures grandes tailles modernes qui tiennent compte des complexes créés par la société. Notre marque offre la disponibilité, la modernité e...",2.0,03-25
58,MILLENIUM (97),22.0,MILLENIUM est un service de restauration gastronomique qui propose des plats originaux et revisités pour vous faire voyager.- Projet porté par Dylan Mangalam...,1.0,03-25
59,FIN MUSEAU (40),15.0,"FIN MUSEAU propose des friandises et compléments alimentaires pour chien à base de super-aliment (chanvre, spiruline et moringa) 100% naturel, sans céréales,...",1.0,03-25
60,FITOUXE (75),620.0,FITOUXE est une application mobile qui a pour vocation de centraliser ce qui se fait de meilleur en terme d'application d'accompagnement sportif et nutrition...,162.0,03-25
61,TAKOTAK (13),132.0,"TAKOTAL est un projet de restauration rapide, saine et locale en click&collect, drive et casiers réfrigérés. Leur mission est de proposer une alternative plu...",13.0,03-25
62,EQTAS.E (37),216.0,"EQTAS.E est une association de prévention santé, par et pour les personnes LGBTQIA+ et/ou celles ayant un handicap. Ils oeuvrent pour réduire les inégalités ...",82.0,03-25
63,AQUAEDEN (78),136.0,"AQUAEDEN a pour objectif de construire un monde meilleur pour les générations futures, au travers du respect de l’environnement et de l’agroalimentaire ; grâ...",33.0,03-25
64,VENOVIA (75),20.0,Venovia a pour objectif de faire oublier la contrainte et simplifier la prise des multiples médicaments au quotidien pour les personnes atteintes de maladies...,0.0,03-25
65,SLOW GO (67),92.0,"SLOWGO est une agence de voyage éco responsable qui propose des itinéraires à faible émission de CO2. Avec SLOW GO, ce seront seulement des transports bas ca...",34.0,03-25
66,FOODYVOR (69),240.0,FOODYVOR est un concept d'accompagnement pour les créateurs culinaires pour donner de la visibilité aux concepts internationaux. Aider les passionnés de food...,117.0,03-25
67,NATUR'ÉVEIL (12),268.0,Le centre d'activités NATUR'ÉVEIL est un lieu d'accueil et d'apprentissage autour de la nature pour les enfants de 6 à 12 ans. C'est un moyen de sensibiliser...,98.0,03-25
68,BIODI (59),40.0,"BIODI accompagne les entreprises dans leur transition écologique avec des team building à impacts, des ateliers de construction, d'observation et de sensibil...",7.0,03-25
69,GATSBI (13),24.0,"GATSBI est une plateforme de vente de billets pour événements permettant aux promoteurs (BDE, artistes, etc.) de se connecter avec leur communauté et prestat...",0.0,03-25
70,DOGGY PARK (42),43.0,DOGGY PARK est un projet de parc de loisirs canin afin de créer un parc éco-responsable qui respecte du bien être animal.- Projet porté par Thomas FayantPour...,3.0,03-25
71,BOOBS (75),124.0,"Boobs améliore les équipements sportifs des femmes aux fortes poitrines pour qu’elles puissent faire du sport en bonnes conditions, tout en regagnant confian...",6.0,03-25
72,LES CENDRIERS DU LITTORAL (13),12.0,Les Cendres du Littoral propose un service d'implantation de cendriers urbains sur tout le littoral marseillais pour pallier à ce déchet trop présent. Des éq...,1.0,03-25
73,ILLICOGREEN (75),16.0,"ILLICOGREEN a pour ambition d'encourager les étudiants dans leur transition écologique malgré leur petit budget, leur manque de connaissance des alternatives...",0.0,03-25
74,CONNEC'TOOLS (58),203.0,Connec'Tools est là pour améliorer la productivité et l'organisation de son utilisateur et également pour lui faire économiser de l'argent. Ils proposent un ...,27.0,03-25
75,FLORIANE SCHMITT STUDIO (67),66.0,"FLORIANE SCHMITT propose un univers élégant et poétique, afin d'offrir à aux clients un style de vie harmonieux et paisible à travers Des collections de prod...",20.0,03-25
76,CRYSTALLUM (95),37.0,CRYSTALLUM est un projet de crédit de consommation aux utilisateurs qui lutte contre la pollution faite par le plastique. Les consommateurs sont rémunérés 10...,13.0,03-25
77,STUDENTS PLACE (59),16.0,STUDENTS PLACE est une entreprise qui vise à améliorer l'accueil des étudiants internationaux en France puis dans d'autres pays. Cette plateforme a été pensé...,0.0,03-25
78,Modu’LAB (51),185.0,"MODU’LAB propose des actions autour de l’éco responsabilité et de la culture. À ce titre, ils mettent en place des projets se modulant aux besoins de leurs p...",36.0,03-25
79,TOUROULE (33),31.0,"TOUROULE propose gratuitement une solution logicielle à télécharger (application mobile). Cette application communique avec des boîtiers de contrôle, à branc...",2.0,03-25
80,VISITCITY (93),18.0,"VISITCITY a pour mission de mettre en relation les voyageurs et les locaux pour favoriser les rencontres, les échanges et contribuer au développement économi...",2.0,03-25
81,ARC (35),106.0,"Dans une époque à forte mondialisation et de mobilité internationale, ARC souhaite rassembler des personnes de cultures différentes grâce à des  apprentissag...",18.0,03-25
82,DISCOREV (38),185.0,Discorev est une plateforme d’excursions authentiques annimées par des personnes passionnées et expérimentées.- Projet porté par Badiss BelhadjPour suivre le...,47.0,03-25
83,OODY (75),38.0,La raison d'être de OODY est de pouvoir protéger la planète tout en préservant le pouvoir d'achat des consommateurs. Leur mission est de réduire l'impact env...,17.0,03-25
84,MEKI MENSTRUATION (75),1757.0,"MEKI, c’est la marque de lingerie menstruelle thérapeutique 100 % confort, 100 % éco-responsable et 100 % made in France ! Leur but premier est de faciliter ...",888.0,03-25
85,COCON (42),995.0,"COCON est un commerce multi espaces autour de la pâtisserie sans gluten et du partage. A travers leurs différents espaces, ils ont à cœur de mettre en avant ...",206.0,03-25
86,MEZ (94),23.0,"MEZ est la volonté de diversifier l’offre des spiritueux infusés / arrangés par d’autres alcools que le rhum, qui sont tout aussi légitimes de l’être par leu...",0.0,03-25
87,EDITIONS CORAMBÉ (57),121.0,"Les Editions Corambé propose des ebooks et des livres papier en impression à la demande, dans le genre de l’imaginaire pour normaliser des héros et héroïnes ...",19.0,03-25
88,FAMS (60),13.0,FAMS est une application de connexion entre des mentors étudiants et jeunes actifs à destination des lycéens.- Projet porté par Cécilia ThomasPour suivre le ...,1.0,03-25
89,BEACH CITY PARADISE (92),29.0,"BEACH CITY PARADISE souhaite diversifier les offres de sports praticables en région parisienne et de créer un centre sportif dédié aux sports de sable,- Proj...",0.0,03-25
90,NAMI (17),333.0,NAMI est un écosystème collaboratif qui contribue à la réduction des émissions de carbone et la valorisation des co-produits de l’industrie française par l’u...,52.0,03-25
91,COLLECTIF MONO (75),25.0,"Le Collectif Mono propose de la création et production d'une gamme de vêtements et accessoires en laine mono matière, 100% recyclables.- Projet porté par Eln...",1.0,03-25
92,LES FRIMEUSES (92),250.0,"Les Frimeuses proposent une gamme de tartinables à base de légumineuses lactofermentées, pour des apéritifs sains et gourmands !- Projet porté par Emma Anque...",126.0,03-25
93,UN GRAM (69),326.0,"UN GRAM propose des smartphones de luxe 100% personnalisables.Le client choisit un matériau noble de son choix (or, diamant, argent, pierres précieuses ou cu...",48.0,03-25
94,SAFE PLACE TO BE (75),55.0,SAFE PLACE TO BE est une application qui a pour but principal de réduire le sentiment d'insécurité dans les transports et de développer l'entraide entreles u...,23.0,03-25
95,REUTEC (59),13.0,"REUTEC propose aux entreprises une solution d’emballage réutilisable sur mesure fais à partir de déchets textiles revalorisés, recyclés ou upcyclés.Ils les a...",1.0,03-25
96,CHERCHEUSE DE STYLE (13),145.0,"CHERCHEUSE DE STYLE est un concept de friperie uniquement pour femme afin changer le regard des gens sur le gaspillage vestimentaire, la pollution, les fripe...",27.0,03-25
97,INTINYVERITAS (75),220.0,InTinyVeritas accompagne les particuliers vers l’indépendance financière en developpant une offre de logements minimalistes autonomes et redynamiser des terr...,40.0,03-25
98,PIHITI (31),6.0,"PIHITI propose des soins naturels polynésiens : simples, minimalistes, sans parfum, respectueux de votre peau et de notre planète. Des soins seuls ou en box ...",0.0,03-25
99,MWANALA (35),99.0,Mwanala c'est la création de collection d'ouvrage de livre de jeunesse qui donne accès à l'éducation pour tous les enfants dans les pays en voie de développe...,27.0,03-25
100,URGE (92),89.0,URGE propose aux hôpitaux de réduire le temps consacré à l'enregistrement et le pré-diagnostic grâce à un algorithme de triage. Réduire le temps d'attente de...,4.0,03-25
101,VANLIZE (94),10.0,VANLIZE fait vivre des experiences singulières et de nouveaux challenges dans un monde où l'on ressent de plus plus un besoin de liberté.Retrouver une manièr...,0.0,03-25
102,LE SON QUI COURT (13),55.0,"La mission du SON QUI COURT est de stimuler et diversifier le paysage musicale Français en démocratisant l'accès aux savoirs, à la culture en propsant un ser...",18.0,03-25
103,JUNO (75),15.0,"JUNO est une plateforme de recrutement abordable, simple et rapide qui met en relation des consultants tech avec des entreprises en recherche. Grace à un alg...",1.0,03-25
104,ART&EAT (77),35.0,"ART&EAT est une plateforme qui allie alimentation et santé : réalisation des achats de produits d'épicerie, la réalisation de menu (en fonction de son régime...",0.0,03-25
105,OWNEY (75),51.0,"OWNEY propose une solution de Location-Accession.Ils achètent le bien pour vous et vous vivez dans votre logement immédiatement, avec une option d'achat de 4...",22.0,03-25
106,DROZZEN (75),71.0,"DROZZEN est une aplli de ""no-dating"" qui permet aux jeunes de se rencontrer facilement en favorisant l'économie locale et en répondant à un enjeu social plus...",22.0,03-25
107,PLENUMI (22),137.0,"PLENUMI est une plateforme de révision et assistant digital du professeur, Plenumi doit permettre aux élèves de mieux travailler (apprentissage actif et pers...",33.0,03-25
108,NEOCA (35),492.0,"NEOCA propose un casque sécurisé pour les mobilités douces qui a la particularité d'être pliable et peut donc facilement se ranger dans un sac. De plus, son ...",136.0,03-25
109,ROSA FOOD (59),243.0,"Le restaurant LA ROSA FOOD offre une restauration mixte respectueux  , entre la tradition et le moderne par l’innovation des goûts et des saveurs, respectueu...",91.0,03-25
110,SUMMIT (35),480.0,"SUMMIT est une boisson énergisante saine et totalement différente de ce que l'on connait actuellement sur le marché. Une boisson 100% naturelle, sans produit...",65.0,03-25
111,CUTIGIRI (59),19.0,CUTIGIRI est un jeu vidéo de type roman vidéoludique (jeux vidéo qui mélangent le gameplay et la littérature) qui a pour but de divertir et d'éduquer sur les...,1.0,03-25
112,TRUST IN ISOTOPES (66),170.0,"TRUST IN ISOTOPES propose un service de traçabilité, reposant sur une analyse chimique (l'isotopie). Elle permet de vérifier la provenance géographique des a...",58.0,03-25
113,RODBY (69),16.0,RODBY propose une mise en relation entre voyageurs et locaux est proposée sur la plateforme. Les locaux s’inscrivent et proposent des parcours et visites faç...,0.0,03-25
114,ORIGINAL GALSEN (94),52.0,ORIGINAL GALSEN propose de découvrir et de savourer la culture sénégalaise à travers des plats originaux. Avec un objectif de proposer des plats 100% fait ma...,21.0,03-25
115,FAIRTROTTER (94),395.0,"FairTrotter se veut devenir la première agence de voyage (presque) zéro carbone destinée au grand public, proposant des séjours uniques et personnalisables, ...",156.0,03-25
116,LE BON PARRAIN (59),10.0,Le Bon Parrain est un site de parrainage qui permet aux utilisateurs de se faire parrainer rapidement et facilement ! Cette mise en relation permet au filleu...,1.0,03-25
117,OTÉ (75),8.0,"OTÉ souhaite faire découvrir une cuisine réunionnaise savoureuse et originale, tout en proposant une expérience culinaire chaleureuse et intense pour les ave...",0.0,03-25
118,OHMYVAN (13),11.0,OHMYVAN souhaite faciliter le voyage en itinérance en véhicule aménagé en créant la maison sur roue des aventuriers.- Projet porté par Elsa ZapataPour suivre...,1.0,03-25
119,MOBILEAZ (59),234.0,MOBILEAZ est une plateforme de location de mobilier et d'électroménager entre particuliers qui favorise l’économie circulaire et d’usage. Elle répond aux pro...,75.0,03-25
120,COUP DE POUSSE (69),37.0,COUP DE POUSSE est un projet de titre-restaurant qui permet le financement de projet de résilience agricole.- Projet porté par Sophia AkmtPour suivre le Moov...,2.0,03-25
121,PULSAE (90),19.0,"PULSAE propose un dispositif de déclenchement intelligent de batterie de vélo électrique pour les personnes en insuffisance cardiaque. Ce dispositif va, en f...",2.0,03-25
122,4BONI (75),143.0,4boni est un marketplace réservé aux étudiants adin de les aider à lutter contre la précarité et l'isolement en créant un écosystème dédié.Projet porté par A...,11.0,03-25
123,STORMZ (69),426.0,"STORMZ est une marque pour équiper les danseurs urbains (hiphop, breakdance) avec des produits résistants, sécurisants et tendances.- Projet porté par Clélia...",156.0,03-25
124,IZOM ATHLETIQUE (94),463.0,"IZOM Athlétique proposera un baume chauffant solide et rechargeable pour aider les sportifs à bien s'échauffer. Par la suite, ils développeront une gamme com...",186.0,03-25
125,L'ATELIER DU GATO (45),396.0,L'Atelier du GatO vise à rendre accessible la pâtisserie aux personnes intolérantes et allergiques au gluten. Briser les idées reçues sur la pâtisserie sans ...,116.0,03-25
126,VIRTUOUS (74),129.0,"Virtuous connecte marques, associations, internautes et créateurs de contenu pour s'engager ensemble à construire le monde. Créer un système vertueux pour fa...",30.0,03-25
127,PHYSIS (2B),10.0,"PHYSIS améliore la sécurité des populations. En effet, que ce soit ses activités de conseil, de bureaux d'études ou encore de la gestion d'application, tout ...",2.0,03-25
128,TINY FUNGI (30),93.0,Tiny Fungi propose une alternative écologique et durable à la construction traditionnelle et fournit une solution de remplacement aux isolants synthétiques n...,27.0,03-25
