,title,views,description,likes,date
138,FEDHUBS (75),51.0,FEEDS HUB propose un outil de visibilité digitale qui recense les commerces écoresponsables qui organisent des événements variés et vendent également un logi...,6.0,03-29
139,KAWABSOR'BRA (91),1203.0,- Projet porté par Hawa BaradjiPour suivre le Moovjee : Site : https://www.moovjee.frFacebook : https://www.facebook.com/moovjeeTwitter : https://twitter.com...,359.0,03-29
140,ALLITRADOR (35),113.0,"Allitrador est une entreprise de traduction au service des TPE, PME et associations qui souhaitent croquer à pleines dents dans leur ouverture vers l'interna...",0.0,03-29
141,HUMAYA (75),63.0,HUMAYA développe des chaussures colorées en cuir upcyclé haut de gamme pour femmes conçue de façon écoresponsable.- Projet porté par Pauline RobertPour suivr...,3.0,03-29
142,GULLU (31),1568.0,"GULLUest un réseau social innovant, facilitateur de revoyure et vecteur pour le tourisme durable. La mission est de rassembler une communauté régie par les m...",435.0,03-29
143,MAISON WELLYNGTON (94),544.0,"La MAISON WELLYNGTON est spécialisée dans la création de tenue de cérémonie sur-mesure, vente de figurine de mode, bijoux et autre accessoires.- Projet porté...",286.0,03-29
144,ITRIDES (44),127.0,ItRides propose des solutions de carnets d'entretiens dématérialisés accessible via un sticker contenant une puce.- Projet porté par Loukas PautonnierPour su...,16.0,03-29
145,ROOOM APP (75),38.0,ROOOM est une application qui aide les participants d’un même événement festif à créer plus facilement des relations entre eux.- Projet porté par Alexandre d...,4.0,03-29
146,MA PETITE MALLE D'ÉVEIL (37),482.0,"Ma Petite Maille d'Éveil propose des bouteilles sensorielles made in France, écologique et respectueuses de l'environnement.- Projet porté par Laurie Verhels...",83.0,03-29
147,VITA LIVE PRO (94),571.0,VITA LIVE PRO est une plateforme web et mobile qui met en relation des résidents en EHPAD et des passionnés à proximité pour faire des activités divers et va...,127.0,03-29
148,MON OUTFIT (33),336.0,"Mon Outfit se veut actrice sociale à travers l'habillement pour un public négligé par les préjugés de la société, en les aidant dans leurs insertion personne...",74.0,03-29
149,SENSOBOX (78),35.0,SENSOBOX éveille les sens au travers d'un choix d'activités sensorielles insolites à vivre en solo ou à deux à Paris et Bordeaux aux côtés d'experts passionn...,1.0,03-29
150,JANE (44),193.0,JANE est une plateforme permettant de diminuer la facture énergétique des collectivités en distribuant leur surplus de production à leur bâtiments communaux ...,18.0,03-29
151,PASSIFLORA APP (44),978.0,PASSIFLORA APP est une application qui informe et soutient les personnes atteintes de phobie scolaire ainsi que leur entourage vers le chemin de la guérison....,267.0,03-29
152,COBALT CONTRACEPTION (78),981.0,"COBALT CONTRACEPTION souhaite mettre sur le marché une contraception masculine naturelle, réversible et non-invasive grâce à un boxer de contraception mascul...",237.0,03-29
153,MAISON DÉMESURE (24),372.0,MAISON DÉMESURE est un bureau d'étude qui va accompagner des créateurs/créatrices pour développer leur collection de lingerie. Ils proposent un accompagnemen...,43.0,03-29
154,QUELYS (31),42.0,QUELYS a pour vocation d'accompagner l'humain & l'entreprise vers la mise en place d'un fonctionnement managérial innovant en complément de l'apport de conse...,2.0,03-29
155,,,,,
156,OSAM (69),948.0,"OSAM est une ligne textile vélo urbain permettant aux cyclistes de se déplacer en étant au sec, au chaud, visible et élégants. En d'autres termes : ne plus f...",242.0,03-29
157,MEETIT (13),47.0,MEETIT est une application qui permet de réduire le gaspillage alimentaire et améliore son pouvoir d’achat en proposant de récupérer à manger des surplus de ...,5.0,03-29
158,MEXA (03),588.0,"Mexa conçoit des jeux et outils pédagogiques adaptés à tous les enfants pour permettre l'inclusion et le vivre ensemble. Ils ont à cœur d'aider les enfants, ...",111.0,03-29
159,ECODESK (34),55.0,"ECODESK est un service de reconditionnement de calculatrices scolaires, à destinations des étudiants issus des QPV/REP. ECODESK achète les calculatrices aux ...",2.0,03-29
160,ENYO WOMEN'S FIGHTWEAR (44),453.0,"Enyo women's fightwear souhaite briser les préjugés sur la pratique féminine des sports de combat en proposant des vêtements techniques, confortables et adap...",114.0,03-29
161,PLANEARIA (30),277.0,"PLANEARIA est une plateforme permettant d'organiser, planifier et partager des voyages sur mesure pour des groupes grâce à un savoureux mélange d'habitudes d...",56.0,03-29
162,MODE EUROPÉENNE (75),63.0,"Mode Européenne propose des vêtements, chaussures, sacs, accesoires de mode qui proviennent des dons de particuliers ou des marques afin de les proposer à pr...",2.0,03-29
163,EVE (75),424.0,"EVE est une plateforme qui permettra à tous de s'organiser en groupe de manière simple, efficace et gratuite.- Projet porté par Maxime BarouilletPour suivre ...",105.0,03-29
164,SOLTEO (75),155.0,SOLTEO développe un logiciel à destination des installateurs photovoltaïques pour leur permettre d'être plus efficaces sur leur tâches support et administrat...,78.0,03-29
165,TRASHTAG (75),268.0,"TRASHTAG relie les associations de clean walking et les entreprises pour compenser l'impact environnemental. Utilisant les nouvelles technologies, nous encou...",84.0,03-29
166,LOUISMANSOUR (75),145.0,LouisMansour propose une gamme de prêt-à-porter et d'accessoires haut de gamme. Des produits genderless imaginés et confectionnés en France. Proposer un univ...,25.0,03-29
167,MOVENDO (69),34.0,MOVENDO accompagne les structures à sensibiliser leur public à la santé mentale grâce à des ateliers et formations engageantes à la fin desquels sont distrib...,0.0,03-29
168,MADAME BEANS (49),888.0,Madame Beans a pour vocation de devenir une entreprise de transformation agroalimentaire de légumes secs en aides culinaires/PAI (Produits Alimentaires Inter...,268.0,03-29
169,SNB (29),32.0,SnB accompagne à la transition environnementale des organisations et leur fournit une expertise de conseil en stratégie produit et process.- Projet porté par...,0.0,03-29
170,L'ÉNERGÉTICIEN (20),46.0,La raison d'être de l'énergéticien est simple : être acteur de la transition énergétique en étant le référent sobriété des entreprises sur les aspects énergi...,3.0,03-29
171,GYMAPP (75),734.0,"GYMAPP c'est la communauté sport fitness et nutrition qui va aider les particuliers à atteindre leurs objectifs sportifs, grâce à la dynamique de groupe, l'e...",182.0,03-29
172,RAFNEE (94),50.0,"RAFNEE est un kit dans lequel on retrouvera l'application en AR pour la formation et/ou de la sensibilisation, des accessoires de AR et des quizz pour des sé...",3.0,03-29
173,IMPRUDENCE DES VOYAGES (76),52.0,"Imprudence des voyages souhaite démocratiser le voyage en immersion culturelle, promouvant le tourisme durable et sortant les voyageurs des sentiers battus. ...",5.0,03-29
174,GOUSSY (68),232.0,"GOUSSY proposera un repas complet, sain et savoureux pratique à emporter dans la poche. Il sera rassasiant, apportera tous les nutriments nécessaires afin d’...",45.0,03-29
175,LIM COMMUNICATION (67),44.0,"Lim Communication est une agence de communication indépendante qui propose des services de rédaction de contenus web, community management, social media mana...",1.0,03-29
176,TRÉVIA (34),130.0,"TREVIA est une application pour gérer toutes les étapes du voyage, de la comparaison à la réservation des d'hébergements et d'activités, conçue pour simplifi...",21.0,03-29
177,TAFTAVIE (59),266.0,TAFTAVIE est une plateforme de mise en relation entre étudiants motivés et talentueux et des entreprises désireuses de se développer en aidant un jeune à dév...,66.0,03-29
178,MA CHAMELLE SUCRÉE (59),609.0,"Ma Chamelle Sucrée a pour mission de rendre accessible à tous la pâtisserie marocaine, sous forme de kit, tout en luttant contre le gaspillage alimentaire.- ...",161.0,03-29
179,ULEX (54),131.0,ULEX propose une nouvelle technologie qui formule un complexe de molécules (molécules actives avec des métaux sous forme colloidale) spécifiques pour des app...,20.0,03-29
180,TRAVAUXETMEUBLES.COM (84),197.0,TRAVAUXETMEUBLES.COM est un accélérateur d’investissement. TRAVAUXETMEUBLES valorise vos ventes dans l’immobilier ancien grâce à un processus comprenant : Vi...,42.0,03-29
181,SANEE (89),349.0,"SANEE offre des produits cosmétiques 100% naturels sous forme de baumes et savons , fabriqués en France, sourcés en Afrique.- Projet porté par Marion SANGENI...",58.0,03-29
182,VALORIZ'ME (49),187.0,"VALORIZ'ME crée, développe et commercialise des snacks protéinés 100% naturels (0 sucres ajoutés, 0 additifs, 0 isolats, 0 conservateurs) à destination de la...",40.0,03-29
183,NOVA (75),237.0,NOVA est la première marque digitale française à offrir une plateforme d'IA collaborative pour accompagner la transformation digitale des ETI/PME en numérisa...,57.0,03-29
184,BEAUTYFOOD (91),1250.0,"BEAUTYFOOD propose une alternative saine, pratique, gourmande et efficace aux compléments alimentaires classiques en offrant une gamme de compléments aliment...",97.0,03-29
185,YESOUICOOK (75),223.0,YESOUICOOK offre aux entrepreneurs culinaires une solution rentable pour développer leur entreprise sans avoir à investir dans leur propre infrastructure et ...,69.0,03-29
186,DELISPEED (59),1472.0,DeliSpeed est une plate-forme (site + appli) permettant aux utilisateur de passer une commande auprès de leurs magasins préférés et d'être livrés par des  pa...,589.0,03-29
187,DYNASTY OF WO/MEN (31),70.0,DYNASTY OF WO/MEN proposera la vente des tee-shirt de fabrication éco responsable avec un panel de tailles allant du XXS au XXL sur lesquels seront apposés d...,6.0,03-29
188,P'TIT ROUDOUDOU (54),976.0,P'tit Roudoudou est une entreprise de confection d’articles de puériculture qui a pour objectif de proposer aux parents des articles de qualité supérieur sel...,185.0,03-29
189,DISCOVER (69),60.0,DISCOVER propose des interventions de professionnels présentant leur parcours scolaire et professionnels dans différents organismes afin de donner une autre ...,2.0,03-29
0,NEWSERS (69),1771.0,"NEWSERS est une application qui offre de l’information à travers trois interfaces (articles, SWIPE, et communautaire). Newsers est donc une solution de débat...",216.0,03-30
1,B.Y.O DESIGNER (94),641.0,"La raison d'être de B.Y.O. Designer est de permettre à tout un chacun d'être le créateur, le styliste de ce qu'il porte.- Projet porté par Mariam TambouraPou...",85.0,03-30
2,EDUCATION DU CHEVAL (83),1897.0,La mission d'EDUCATION DU CHEVAL est de faire évoluer l'équitation vers des pratiques plus justes et éthiques pour l'animal afin de diminuer le nombre d'acci...,334.0,03-30
3,CENTRAL EVENTS (90),202.0,"CENTRAL EVENTS souhaite créer et développer une plateforme de mise en relation entre les prestataires liés à l'événementiel et leurs clients, afin de simplif...",4.0,03-30
4,LOOSE SOULS (31),200.0,La raison d'être de LOOSE SOULS c'est représenter les artistes féminines et non binaires sur la scène musicale. Ils proposent de présenter ces artistes par l...,1.0,03-30
5,L'IDÉE D'UNE BOITE (95),981.0,L'IDÉE D'UNE BOITE souhaite développer des boîtes mystères thématiques interactives qui permettent de vivre une expérience lors de l’ouverture séquencée et p...,128.0,03-30
6,SKANERS (92),214.0,"SKANERS est une application qui permet d’identifier et acheter les paires de sneakers qui vous entourent avec une photo ! Autrement dit, c'est le ""Shazam"" de...",6.0,03-30
7,ALGUP (06),941.0,AlgUp développe un bioréacteur qui permet de produire de la spiruline fraîche chez soi et sans entretien. Conçu pour être à la fois esthétique et facile d’ut...,145.0,03-30
8,KOOKABURRA KOMBUCHA (59) Kookaburra Kombucha,355.0,"KOOKABURRA KOMBUCHA propose la vente de Kombucha, une boisson asiatique.- Projet porté par Elise GensPour suivre le Moovjee : Site : https://www.moovjee.frFa...",13.0,03-30
9,RENTY (75),394.0,"RENTY est une plateforme en ligne pour la location d'équipements sportifs entre particuliers, et une assurance facultative pour les locataires pour couvrir l...",35.0,03-30
10,RACE&LOCK (92),1720.0,"RACE&LOCK propose un cadenas de vélo à triple usage, offrant aux vélos urbains ou électriques un porte-bagages et aux vélos sportifs une position de course a...",307.0,03-30
11,24-7 (67),1322.0,"24-7 souhaite fournir des aliments durables et nutritifs, sans compromis sur le goût, la qualité et le prix afin de créer un avenir meilleur et plus sain pou...",114.0,03-30
12,BECOME (67),248.0,"BECOME souhaite faciliter la prise de décisions complexe par la réécriture rapide et neutre de votre démarche et situations.Adopter des comportements, compét...",17.0,03-30
13,TALEOS (77),97.0,TALEOS est une application de réveil personnalisée selon son chronotype qui améliore son sommeil et ses performances cognitives pour optimiser son temps chaq...,1.0,03-30
14,NYMPHEIASHOP (35),114.0,NYMPHEIASHOP crée des oeuvres au format numérique mais également des illustrations sous forme de produits physiques tels que des cartes postales et des badge...,12.0,03-30
15,STUDPRO (75),132.0,STUDPRO est une application web et mobile pensée pour révolutionner le quotidien des étudiants. Elle permettra aux étudiants de trouver leur entreprise d’acc...,7.0,03-30
16,ARTY SQUAD (75),368.0,ART-SQUAD accompagne les entreprises soucieuses d'améliorer leur expérience collaborateur et l'engagement de leur équipe grâce à l'art et à la culture afin d...,55.0,03-30
17,THE OFFSZN (69),645.0,La raison d'être d'OFFSZN est de créer un mouvement social et inclusif autour de la pratique du basket en France en créant des opportunités sociales et sport...,100.0,03-30
18,HOLMI (94),542.0,HOLMI propose des vêtements éthiques et éco-responsables. Ils prennent le temps de développer chaque pièce pour qu'elles conviennent à un maximum de morpholo...,102.0,03-30
19,POGUISURF (59),280.0,"POGUISURF propose une location longue durée d'une planche de surf éco-responsable qui est produite localement, réparable et avec une durée de vie 5 fois supé...",28.0,03-30
20,BE BUDDY (69),122.0,La mission de BE BUDDY est d'offrir une nouvelle façon de voyager au plus proche de la culture locale grâce à un guide digital personnalisé. Ils ont à coeur ...,7.0,03-30
21,TOGÆTHER (34),1321.0,"TOGÆTHER est une application directement sur le mobile des spectateurs ainsi qu'un appareil de géolocalisation positionné sur les sportifs. Les deux liés, on...",310.0,03-30
22,DOUCEUR DANS L'HAIR (22),264.0,DOUCEUR DANS L'HAIR a pour projet de développer des gammes de produits capillaires pour cheveux texturés à base de beurres et d'huiles végétales afro-caraibé...,63.0,03-30
23,NEATY (83),56.0,"NEATY a pour objectif de développer une marque de produits de première nécessité écoresponsable (rechargeables), avec une composition saine mais également in...",1.0,03-30
24,YUKI (13),750.0,YUKI propose des jeux uniques et personnalisés qui rapprochent les gens !- Projet porté par Benoit CatanesePour suivre le Moovjee : Site : https://www.moovje...,135.0,03-30
25,RECIT (94),93.0,"Avec RECIT, concevez le livre des moments les plus importants de votre vie à transmettre à vos proches. Enregistrez les histoires de vos proches. Ces dernièr...",11.0,03-30
26,KASSY (75),214.0,KASSY est une société commerciale qui a pour objectif de faire découvrir aux consommateurs des produits artisanaux provenant de différentes régions du monde....,19.0,03-30
27,OVA DETECH (17),1249.0,OVA DETECH accompagne toutes les femmes du début de leur vie sexuelle jusqu’à la ménopause en leur permettant de mieux connaitre leur cycle et donc d’adapter...,182.0,03-30
28,MELOTICK (92),531.0,"MELOTICK est une plateforme culturelle regroupant un agenda culturel pour trouver des événements culturels en France, une bourse aux billets pour acheter ou ...",102.0,03-30
29,V.UBIK (57),135.0,V.UBIK veut intégrer le marché de l'esport en diffusant les différentes parties League of Legend à travers un avatar dans une salle afin de pouvoir partager ...,15.0,03-30
30,PERLA MODA (35),111.0,Perla Moda propose à ses clients des accessoires durables en perles faits à la main qui allient créativité et esthétique pour rendre le luxe d’un bijou ou d’...,17.0,03-30
31,HORMONE.IA (75),130.0,HORMONE.IA développe le premier assistant de fertilité pour couple. Ce dispositif médical (DM) permettra d'accompagner hommes et femmes dans leur parcours de...,15.0,03-30
32,AULIA (59),238.0,La mission d'AULIA est de soulager l'aidant familial dans l'organisation de la dépendance d'une personne en perte d’autonomie à domicile.- Projet de Jade Nue...,36.0,03-30
33,DYOQAR (59),82.0,DYOQAR propose du matériel sportif durables et uniques pour les activités de sport & bien-être à domicile fabriqués à partir de matières bioscourcées.- Proje...,1.0,03-30
34,PAVENROD (74),360.0,PAVENROD est né de la volonté de préserver la montagne en développer un vestiaire complet homme / femme de vêtements outdoor performants made in France en ma...,86.0,03-30
35,MINUIT BLONDE (13),1517.0,MINUIT BLONDE est une agence artistique qui propose :- La vente en ligne de pièces produites par des créateurs indépendants- L'organisation d'évènements cult...,315.0,03-30
36,OPENDO (57),52.0,"OPENDO est une épicerie nocturne lambda spécialisée dans les produits exotiques et multiculturels, notamment avec un étalage de fruits et légumes tropicaux, ...",1.0,03-30
37,TASH (44),51.0,TASH souhaite devenir la plateforme référente pour la création de marque de mode originale et responsable. TASH permet aux créateurs de contenu de facilement...,1.0,03-30
38,CELESTINE HAIR MAKEUP ARTIS (59),94.0,CELESTINE HAIR MAKEUP ARTIST propose des prestations de maquillage.- Projet porté par Célestine HelynckPour suivre le Moovjee : Site : https://www.moovjee.fr...,5.0,03-30
39,REVOLEAF (31),60.0,"REVOLEAF propose une culture végétale à base de lentille d'eau. Cette culture amène un nouveau produit frais avec qualités nutritionnelles essentielles, une ...",1.0,03-30
40,FREE2BET (57),66.0,Free2bet est une application mobile de paris sportifs gratuits. Ici pas d'argent en jeu mais des crédits virtuels qui peuvent ensuite être échangés contre de...,0.0,03-30
41,SAUVÈ (69),63.0,"SAUVÈ, ce sont des barres nutritionnelles naturellement riches en fer qui permettent d'optimiser et de renforcer les apports en fer au quotidien.- Projet por...",1.0,03-30
42,LES BELLES TRUFFES (92),1138.0,Les Belles Truffes ont pour mission de contribuer aux bien-être des chiens en proposant un service premium et ultra-personnalisé de micro-crèche canine . Par...,190.0,03-30
43,HAPPYPRO (17),1215.0,"HappyPro met en relation des professionnels et des particuliers pour du service à domicile de courte durée (PetSitting/Ménage/..). Le concept, regrouper les ...",290.0,03-30
44,MADE IN CLÉMENCE (49),62.0,"Via le processus de surcyclage (ou upcycling), Made In Clémence  transforme les déchets textiles en produits responsables proposés aux particuliers et aux pr...",4.0,03-30
45,IKIDAÏ (59),55.0,"IKIDAÏ développe des bornes interactives et créatives pour enfants. Créatrices de lien social entre enfants et avec leurs accompagnateurs, leurs bornes perme...",0.0,03-30
46,HELLO WASTE (22),106.0,Hello Waste a pour objectif de protéger l'humain et l'environnement. Ils imaginent les objets de demain avec les déchets d'aujourd'hui en proposant de la fab...,4.0,03-30
47,COSPLAY SMART (83),409.0,COSPLAY SMART est un projet de boutique en ligne de vente de produit pour la réalisation de costume cosplay et un service de réalisation de costume sur-mesur...,95.0,03-30
48,SAMADHA (69),288.0,SAMADHA est une boutique en ligne dédiée à l’Ayurvéda qui sélectionne les meilleures marques de produits et propose des outils pratiques et inspirants pour v...,79.0,03-30
49,BLOOSENS (75),1825.0,La mission de BLOOSENS est d'apporter une solution à toutes les personnes gênées par leurs douleurs menstruelles. Soulager leur quotidien en leur apportant u...,413.0,03-30
50,PHEASE (74),51.0,PHEASE met à disposition des projets à impact grâce à une plateforme qui assure la transparence de leurs fonds et mettre en avant l'impact réalisé. Cette pla...,2.0,03-30
51,LCDG (64),1636.0,"LCDG souhaite rendre accessible la communication physique de produits ou de services plus éthiques, tout en apportant un complément de revenu sans effort sup...",386.0,03-30
52,MITUP (95),104.0,MITUP favorise l'insertion des jeunes talents sur le marché de l'emploi et les accompagner dans leur entrée dans la vie active.  Le service proposé est un ab...,15.0,03-30
53,MOKILO PACKAGE (44),81.0,Mokilo Package est une plateforme marketplace de co-bagage qui connecte les voyageurs pour qu'ils partagent les frais de transport de leurs bagages. Un servi...,4.0,03-30
54,GREEZ (28),68.0,"Greez est une plateforme E-commerce spécialisée dans la gestion d’invendus cosmétiques. Les professionnels, distributeurs qui ont des produits invendus les s...",4.0,03-30
55,ASYORA (92),308.0,ASYORA est un outil de collaboration permettant de repenser la notion de réunion en entreprise.- Projet porté par Paul-Emmanuel BrouxPour suivre le Moovjee :...,53.0,03-30
56,KAYLO (91),86.0,"Kaylo est une application mobile qui permet de faire ses courses et de commander son panier en livraison, en click & collect dans le supermarché où son panie...",1.0,03-30
57,SIZZY (75),136.0,"SIZZY ce sont chaussures grandes tailles modernes qui tiennent compte des complexes créés par la société. Notre marque offre la disponibilité, la modernité e...",18.0,03-30
58,MILLENIUM (97),200.0,MILLENIUM est un service de restauration gastronomique qui propose des plats originaux et revisités pour vous faire voyager.- Projet porté par Dylan Mangalam...,33.0,03-30
59,FIN MUSEAU (40),216.0,"FIN MUSEAU propose des friandises et compléments alimentaires pour chien à base de super-aliment (chanvre, spiruline et moringa) 100% naturel, sans céréales,...",32.0,03-30
60,FITOUXE (75),1183.0,FITOUXE est une application mobile qui a pour vocation de centraliser ce qui se fait de meilleur en terme d'application d'accompagnement sportif et nutrition...,231.0,03-30
61,TAKOTAK (13),174.0,"TAKOTAL est un projet de restauration rapide, saine et locale en click&collect, drive et casiers réfrigérés. Leur mission est de proposer une alternative plu...",20.0,03-30
62,EQTAS.E (37),376.0,"EQTAS.E est une association de prévention santé, par et pour les personnes LGBTQIA+ et/ou celles ayant un handicap. Ils oeuvrent pour réduire les inégalités ...",101.0,03-30
63,AQUAEDEN (78),781.0,"AQUAEDEN a pour objectif de construire un monde meilleur pour les générations futures, au travers du respect de l’environnement et de l’agroalimentaire ; grâ...",142.0,03-30
64,VENOVIA (75),250.0,Venovia a pour objectif de faire oublier la contrainte et simplifier la prise des multiples médicaments au quotidien pour les personnes atteintes de maladies...,71.0,03-30
65,SLOW GO (67),369.0,"SLOWGO est une agence de voyage éco responsable qui propose des itinéraires à faible émission de CO2. Avec SLOW GO, ce seront seulement des transports bas ca...",95.0,03-30
66,FOODYVOR (69),516.0,FOODYVOR est un concept d'accompagnement pour les créateurs culinaires pour donner de la visibilité aux concepts internationaux. Aider les passionnés de food...,159.0,03-30
67,NATUR'ÉVEIL (12),853.0,Le centre d'activités NATUR'ÉVEIL est un lieu d'accueil et d'apprentissage autour de la nature pour les enfants de 6 à 12 ans. C'est un moyen de sensibiliser...,190.0,03-30
68,BIODI (59),102.0,"BIODI accompagne les entreprises dans leur transition écologique avec des team building à impacts, des ateliers de construction, d'observation et de sensibil...",9.0,03-30
69,GATSBI (13),72.0,"GATSBI est une plateforme de vente de billets pour événements permettant aux promoteurs (BDE, artistes, etc.) de se connecter avec leur communauté et prestat...",1.0,03-30
70,DOGGY PARK (42),357.0,DOGGY PARK est un projet de parc de loisirs canin afin de créer un parc éco-responsable qui respecte du bien être animal.- Projet porté par Thomas FayantPour...,70.0,03-30
71,BOOBS (75),392.0,"Boobs améliore les équipements sportifs des femmes aux fortes poitrines pour qu’elles puissent faire du sport en bonnes conditions, tout en regagnant confian...",44.0,03-30
72,LES CENDRIERS DU LITTORAL (13),48.0,Les Cendres du Littoral propose un service d'implantation de cendriers urbains sur tout le littoral marseillais pour pallier à ce déchet trop présent. Des éq...,2.0,03-30
73,ILLICOGREEN (75),166.0,"ILLICOGREEN a pour ambition d'encourager les étudiants dans leur transition écologique malgré leur petit budget, leur manque de connaissance des alternatives...",37.0,03-30
74,CONNEC'TOOLS (58),449.0,Connec'Tools est là pour améliorer la productivité et l'organisation de son utilisateur et également pour lui faire économiser de l'argent. Ils proposent un ...,47.0,03-30
75,FLORIANE SCHMITT STUDIO (67),133.0,"FLORIANE SCHMITT propose un univers élégant et poétique, afin d'offrir à aux clients un style de vie harmonieux et paisible à travers Des collections de prod...",23.0,03-30
76,CRYSTALLUM (95),134.0,CRYSTALLUM est un projet de crédit de consommation aux utilisateurs qui lutte contre la pollution faite par le plastique. Les consommateurs sont rémunérés 10...,20.0,03-30
